{
  "id": "renderer-web/presentation-capabilities",
  "coverage": {
    "blockTypes": ["studio.core/heading"],
    "behaviors": [],
    "presentation": [
      "alignment",
      "inverse",
      "markers",
      "motion",
      "position",
      "print",
      "responsive-visibility",
      "scrolling",
      "sizing",
      "spacing"
    ],
    "security": []
  },
  "roots": [
    {
      "authoring": { "mode": "content" },
      "bindings": {},
      "id": "presentation",
      "properties": {
        "level": 2,
        "design": {
          "align": "center",
          "animation": "slide",
          "height": "viewport",
          "inverse": true,
          "margin": "comfortable",
          "marker": "check",
          "padding": "spacious",
          "position": "sticky",
          "print": "hide",
          "scrolling": "snap",
          "visibility": { "compact": "hidden", "medium": "visible", "expanded": "hidden" },
          "width": "full"
        }
      },
      "slots": {},
      "type": "studio.core/heading",
      "version": "1.0.0"
    }
  ],
  "bindings": [{ "nodeId": "presentation", "port": "text", "value": "Presentation" }],
  "media": [],
  "context": {
    "scopedStyles": {
      "presentation": {
        "rules": [
          {
            "target": "self",
            "declarations": { "font-weight": "700", "color": "#123456" }
          }
        ]
      }
    }
  },
  "expect": {
    "activationMarkers": [],
    "cssBytes": 6396,
    "cssSha256": "71a06ec1f946881ef7b3dd0a2ce40281b749c70d5a2244c90e35191c2364e774",
    "htmlBytes": 588,
    "htmlSha256": "6a2e806f511a09bac4508c13ae6a91d0bb6e0456e740255c09f4740e70cf1350",
    "publicStyleAsset": {
      "path": "assets/studio-public-71a06ec1f946881e.min.css",
      "role": "public-style",
      "mediaType": "text/css",
      "bytes": 6396,
      "budgetBytes": 262144,
      "contentHash": "71a06ec1f946881ef7b3dd0a2ce40281b749c70d5a2244c90e35191c2364e774",
      "integrity": "sha256-caBuwflGiB73s90KLOQCgbdJxw1aIkTJDjUZHCNk53Q=",
      "minified": true
    },
    "htmlContains": [
      "data-studio-align=\"center\"",
      "data-studio-animation=\"slide\"",
      "data-studio-height=\"viewport\"",
      "data-studio-inverse=\"true\"",
      "data-studio-margin=\"comfortable\"",
      "data-studio-marker=\"check\"",
      "data-studio-padding=\"spacious\"",
      "data-studio-position=\"sticky\"",
      "data-studio-print=\"hide\"",
      "data-studio-scroll=\"snap\"",
      "data-studio-visible-compact=\"hidden\"",
      "data-studio-visible-medium=\"visible\"",
      "data-studio-visible-expanded=\"hidden\"",
      "data-studio-width=\"full\""
    ],
    "htmlExcludes": ["style=", "<script"],
    "cssContains": [
      "data-studio-position=sticky",
      "color:#123456;font-weight:700",
      "data-studio-motion",
      "@media print",
      "width>=48rem",
      "width>=75rem"
    ],
    "enhancements": ["motion"]
  }
}
