{
  "id": "renderer-web/blob-default-deny",
  "coverage": {
    "blockTypes": ["studio.core/image"],
    "behaviors": [],
    "presentation": [],
    "security": ["blob-default-deny"]
  },
  "roots": [
    {
      "authoring": { "mode": "content" },
      "bindings": {},
      "id": "blob-default",
      "properties": { "fit": "cover", "loading": "lazy" },
      "slots": {},
      "type": "studio.core/image",
      "version": "1.0.0"
    }
  ],
  "bindings": [
    {
      "nodeId": "blob-default",
      "port": "asset",
      "value": {
        "contractVersion": "0.1-draft",
        "kind": "media-reference",
        "assetId": "local",
        "usage": "studio.media/content",
        "accessibility": { "mode": "informative", "altText": "Local" }
      }
    }
  ],
  "media": [
    {
      "assetId": "local",
      "src": "blob:https://studio.example.test/323e4567-e89b-12d3-a456-426614174000",
      "altText": "Local",
      "mediaType": "image/png"
    }
  ],
  "expect": {
    "activationMarkers": [],
    "cssBytes": 6320,
    "cssSha256": "8d4d00dfa489396dc0a4207b3d1efa207d7658e325c9db4bba2e74b91a607649",
    "htmlBytes": 153,
    "htmlSha256": "c4bc7134b14028faf96ee6166f3925e0cbbbc0f17457a969fcbacf1d1f4dd79f",
    "publicStyleAsset": {
      "path": "assets/studio-public-8d4d00dfa489396d.min.css",
      "role": "public-style",
      "mediaType": "text/css",
      "bytes": 6320,
      "budgetBytes": 262144,
      "contentHash": "8d4d00dfa489396dc0a4207b3d1efa207d7658e325c9db4bba2e74b91a607649",
      "integrity": "sha256-jU0A36SJOW3ApCB7PR76IH12WOMlydtLui50uRpgdkk=",
      "minified": true
    },
    "htmlContains": ["Image unavailable"],
    "htmlExcludes": ["blob:https://"],
    "cssContains": ["prefers-reduced-motion"],
    "enhancements": []
  }
}
